{
  "metadata": {
    "title": "Digital Dreams",
    "artist": "Board Music Team",
    "charter": "AI Generated",
    "difficulty": "HARD",
    "level": 9,
    "bpm": 140,
    "offset": 0,
    "duration": 45000,
    "audioFile": "audio/digital-dreams.mp3",
    "previewStart": 10000,
    "createdAt": "2025-12-11T00:00:00Z",
    "description": "A challenging chart with complex patterns"
  },
  "gameConfig": {
    "lanes": 4,
    "noteSpeed": 1.2,
    "judgeOffset": 0
  },
  "notes": [
    {"time": 857, "lane": 0, "type": "tap", "duration": 0},
    {"time": 857, "lane": 2, "type": "tap", "duration": 0},
    {"time": 1071, "lane": 1, "type": "tap", "duration": 0},
    {"time": 1286, "lane": 2, "type": "tap", "duration": 0},
    {"time": 1500, "lane": 3, "type": "tap", "duration": 0},
    {"time": 1714, "lane": 2, "type": "tap", "duration": 0},
    {"time": 1929, "lane": 1, "type": "tap", "duration": 0},
    {"time": 2143, "lane": 0, "type": "tap", "duration": 0},
    {"time": 2357, "lane": 0, "type": "tap", "duration": 0},
    {"time": 2357, "lane": 3, "type": "tap", "duration": 0},
    {"time": 2571, "lane": 1, "type": "tap", "duration": 0},
    {"time": 2786, "lane": 2, "type": "tap", "duration": 0},
    {"time": 3000, "lane": 1, "type": "tap", "duration": 0},
    {"time": 3000, "lane": 3, "type": "tap", "duration": 0},
    {"time": 3214, "lane": 0, "type": "tap", "duration": 0},
    {"time": 3429, "lane": 1, "type": "tap", "duration": 0},
    {"time": 3643, "lane": 2, "type": "tap", "duration": 0},
    {"time": 3857, "lane": 0, "type": "tap", "duration": 0},
    {"time": 3857, "lane": 1, "type": "tap", "duration": 0},
    {"time": 3857, "lane": 2, "type": "tap", "duration": 0},
    {"time": 4071, "lane": 3, "type": "tap", "duration": 0},
    {"time": 4286, "lane": 2, "type": "tap", "duration": 0},
    {"time": 4500, "lane": 1, "type": "tap", "duration": 0},
    {"time": 4714, "lane": 0, "type": "tap", "duration": 0},
    {"time": 4929, "lane": 1, "type": "tap", "duration": 0},
    {"time": 5143, "lane": 2, "type": "tap", "duration": 0},
    {"time": 5357, "lane": 3, "type": "tap", "duration": 0},
    {"time": 5571, "lane": 0, "type": "tap", "duration": 0},
    {"time": 5571, "lane": 2, "type": "tap", "duration": 0},
    {"time": 5786, "lane": 1, "type": "tap", "duration": 0},
    {"time": 5786, "lane": 3, "type": "tap", "duration": 0},
    {"time": 6000, "lane": 0, "type": "tap", "duration": 0},
    {"time": 6107, "lane": 1, "type": "tap", "duration": 0},
    {"time": 6214, "lane": 2, "type": "tap", "duration": 0},
    {"time": 6321, "lane": 3, "type": "tap", "duration": 0},
    {"time": 6429, "lane": 2, "type": "tap", "duration": 0},
    {"time": 6536, "lane": 1, "type": "tap", "duration": 0},
    {"time": 6643, "lane": 0, "type": "tap", "duration": 0},
    {"time": 6857, "lane": 0, "type": "tap", "duration": 0},
    {"time": 6857, "lane": 1, "type": "tap", "duration": 0},
    {"time": 6857, "lane": 2, "type": "tap", "duration": 0},
    {"time": 6857, "lane": 3, "type": "tap", "duration": 0},
    {"time": 7500, "lane": 1, "type": "tap", "duration": 0},
    {"time": 7714, "lane": 2, "type": "tap", "duration": 0},
    {"time": 7929, "lane": 3, "type": "tap", "duration": 0},
    {"time": 8143, "lane": 0, "type": "tap", "duration": 0},
    {"time": 8143, "lane": 3, "type": "tap", "duration": 0},
    {"time": 8357, "lane": 1, "type": "tap", "duration": 0},
    {"time": 8571, "lane": 2, "type": "tap", "duration": 0},
    {"time": 8786, "lane": 1, "type": "tap", "duration": 0},
    {"time": 8786, "lane": 3, "type": "tap", "duration": 0},
    {"time": 9000, "lane": 0, "type": "tap", "duration": 0},
    {"time": 9214, "lane": 1, "type": "tap", "duration": 0},
    {"time": 9429, "lane": 2, "type": "tap", "duration": 0},
    {"time": 9643, "lane": 3, "type": "tap", "duration": 0},
    {"time": 9857, "lane": 0, "type": "tap", "duration": 0},
    {"time": 9857, "lane": 1, "type": "tap", "duration": 0},
    {"time": 9857, "lane": 2, "type": "tap", "duration": 0}
  ],
  "timing": [
    {"time": 0, "bpm": 140}
  ]
}
